{
    "fallback_count": 1,
    "fallback_codes": [
        "html_form_fallback"
    ],
    "dropped_elements": [
        {
            "selector": "header:nth-of-type(1) > div:nth-of-type(1) > a:nth-of-type(1) > svg:nth-of-type(1)",
            "tag": "svg"
        }
    ],
    "block_histogram": {
        "core/button": 2,
        "core/buttons": 2,
        "core/column": 8,
        "core/columns": 4,
        "core/group": 26,
        "core/heading": 12,
        "core/html": 1,
        "core/image": 1,
        "core/list": 3,
        "core/list-item": 9,
        "core/navigation": 1,
        "core/navigation-link": 4,
        "core/paragraph": 18,
        "core/quote": 1,
        "core/table": 1
    },
    "carried_css_bytes": 14394,
    "fixup_outcomes": {
        "normalize-layout": "mutated",
        "contrast-fix": "noop",
        "motion-sanity": "noop",
        "fix-blocks": "mutated"
    },
    "header_detected": true,
    "footer_detected": true
}
